<?xml version="1.0" encoding="UTF-8"?>
<postcards xmlns:xsi="http://www.w3.org/2001/XMLSchema-instance"
           xmlns="resourses/data"
           xsi:schemaLocation="resourses/data postcard.xsd">

  <common_postcard id="card01" name="Squirrel">
    <paper>
      <density>300</density>
      <is_gloss>true</is_gloss>
      <size>
        <length>15</length>
        <width>10</width>
      </size>
    </paper>
    <country>Great Britain</country>
    <year>2019-09-13</year>
    <author>Richard Hood</author>
    <thema>animals</thema>
  </common_postcard>
  
  <common_postcard id="card02" name="Vilnius">
    <paper>
      <density>325</density>
      <is_gloss>true</is_gloss>
      <size>
        <length>15</length>
        <width>10</width>
      </size>
    </paper>
    <country>Lithuania</country>
    <year>2013-10-09</year>
    <author>L. Jankauskas</author>
    <thema>architecture</thema>
  </common_postcard>
  
  <common_postcard id="card03" name="Harry Potter">
    <paper>
      <density>325</density>
      <is_gloss>false</is_gloss>
      <size>
        <length>15</length>
        <width>10</width>
      </size>
    </paper>
    <country>Russia</country>
    <year>2018-07-24</year>
    <author>Grape_Art_Com</author>
    <thema>movies</thema>
  </common_postcard>
  
  <common_postcard id="card04" name="Lynx and lynx kitten">
    <paper>
      <density>325</density>
      <is_gloss>false</is_gloss>
      <size>
        <length>15</length>
        <width>10</width>
      </size>
    </paper>
    <country>Belarus</country>
    <year>2020-12-15</year>
    <author>-</author>
    <thema>maxicards</thema>
  </common_postcard>
  
  <advertising_postcard id="card05" name="Stroke">
    <paper>
      <density>300</density>
      <is_gloss>true</is_gloss>
      <size>
        <length>16</length>
        <width>11</width>
      </size>
    </paper>
    <country>Great Britain</country>
    <year>2009-03-13</year>
    <author>-</author>
    <company>Stroke</company>
    <web_site>stroke.org.uk</web_site>
  </advertising_postcard>
  
  <common_postcard id="card06" name="Schwedt">
    <paper>
      <density>300</density>
      <is_gloss>true</is_gloss>
      <size>
        <length>15</length>
        <width>10</width>
      </size>
    </paper>
    <country>Germany</country>
    <year>1989-05-28</year>
    <author>Zoepffel</author>
    <thema>architecture</thema>
  </common_postcard>
  
  <congratulatory_postcard id="card07" name="Happy birthday">
    <paper>
      <density>325</density>
      <is_gloss>false</is_gloss>
      <size>
        <length>15</length>
        <width>10</width>
      </size>
    </paper>
    <country>Russia</country>
    <year>1991-01-29</year>
    <author>I. Dergileva</author>
    <holiday>Birthday</holiday>
    <message>Happy Birthday!!!</message>
  </congratulatory_postcard>
  
  <common_postcard id="card08" name="Blue cats">
    <paper>
      <density>350</density>
      <is_gloss>true</is_gloss>
      <size>
        <length>15</length>
        <width>10</width>
      </size>
    </paper>
    <country>Belarus</country>
    <year>2017-11-04</year>
    <author>I. Zenyuk</author>
    <thema>art</thema>
  </common_postcard>
  
  <congratulatory_postcard id="card09" name="Marry Christmas">
    <paper>
      <density>325</density>
      <is_gloss>false</is_gloss>
      <size>
        <length>15</length>
        <width>10</width>
      </size>
    </paper>
    <country>Germany</country>
    <year>2001-06-22</year>
    <author>Corazza</author>
    <holiday>Christmas</holiday>
    <message>Marry Christmas!!!</message>
  </congratulatory_postcard>
  
  <common_postcard id="card10" name="Scenery">
    <paper>
      <density>325</density>
      <is_gloss>false</is_gloss>
      <size>
        <length>15</length>
        <width>10</width>
      </size>
    </paper>
    <country>Russia</country>
    <year>1986-03-17</year>
    <author>V. Mitin</author>
    <thema>nature</thema>
  </common_postcard>
  
  <common_postcard id="card11" name="Hotel 'Paris'">
    <paper>
      <density>300</density>
      <is_gloss>true</is_gloss>
      <size>
        <length>15</length>
        <width>10</width>
      </size>
    </paper>
    <country>Belarus</country>
    <year>2016-10-16</year>
    <author>T. Kuznetsova</author>
    <thema>architecture</thema>
  </common_postcard>
  
  <common_postcard id="card12" name="Old Minsk">
    <paper>
      <density>300</density>
      <is_gloss>false</is_gloss>
      <size>
        <length>15</length>
        <width>10</width>
      </size>
    </paper>
    <country>Belarus</country>
    <year>2016-07-25</year>
    <author>T. Kuznetsova</author>
    <thema>architecture</thema>
  </common_postcard>
  
  <advertising_postcard id="card13" name="Animia">
    <paper>
      <density>325</density>
      <is_gloss>true</is_gloss>
      <size>
        <length>15</length>
        <width>10</width>
      </size>
    </paper>
    <country>Belarus</country>
    <year>2018-11-17</year>
    <author>Wikipet</author>
    <company>Wikipet</company>
    <web_site>wikipet.by</web_site>
  </advertising_postcard>
  
  <common_postcard id="card14" name="Greta Garbo">
    <paper>
      <density>325</density>
      <is_gloss>true</is_gloss>
      <size>
        <length>15</length>
        <width>10</width>
      </size>
    </paper>
    <country>Russia</country>
    <year>2014-04-29</year>
    <author>I. Paltser</author>
    <thema>famous people</thema>
  </common_postcard>
  
  <common_postcard id="card15" name="Reiterbildnis">
    <paper>
      <density>325</density>
      <is_gloss>true</is_gloss>
      <size>
        <length>15</length>
        <width>10</width>
      </size>
    </paper>
    <country>Germany</country>
    <year>2020-08-10</year>
    <author>Jurgen Fuhrmann</author>
    <thema>art</thema>
  </common_postcard>
  
  <advertising_postcard id="card16" name="Gerber">
    <paper>
      <density>325</density>
      <is_gloss>false</is_gloss>
      <size>
        <length>15</length>
        <width>10</width>
      </size>
    </paper>
    <country>Lithuania</country>
    <year>2010-04-13</year>
    <author>Baddog</author>
    <company>Gerber</company>
    <web_site>www.baddog.lt</web_site>
  </advertising_postcard>
  
</postcards>